{
  "segment_id": "15_incident2_ace_exploit",
  "title": "SCP-8980 該当箇所 15 査読",
  "source_en_path": "articles/fragment_scp-8980-1/segments/en/15_incident2_ace_exploit.wikidot",
  "source_jp_path": "`congy.wikidot` 行 3578-3950 付近",
  "source_range": {
    "start": 3578,
    "end": 3950,
    "note": "`congy.wikidot` 行 3578-3950 付近"
  },
  "usage_notes": [
    "この箇所は、担当医の宥め、SCP-8980 の絶望、バーンズ再登場の衝撃、制度語の冷たさが一気に噴き出す場面である。\nしたがって、慣用句、呼称、薬理語、動作、感情の噴出をすべて雑に扱えない。",
    "- `[ERROR]` はそのまま修正対象\n- `[NOTE]` は補強候補として残す\n- `[OUT-OF-SCOPE]` はこの箇所単体の修正指示から外す"
  ],
  "overview": [
    "この箇所で落としてはならないのは次の 4 点である。",
    "- 担当医の宥め文句は、安心させる声ではなく責任回避の定型句として聞こえること\n- バーンズを見た瞬間の SCP-8980 の絶望が平板化しないこと\n- 室内動作と薬理語を正しく読むこと\n- 末尾の調査コメントが、ただの要約ではなく冷たい制度語として残ること",
    "ここを普通の医療場面の日本語で均すと、「助けを求めても制度ごと見殺しにされる場面」が、単に怖い処置の記録へ痩せる。"
  ],
  "issues": [
    {
      "id": "E-15-00",
      "severity": "error",
      "order": 1,
      "heading": "監査許可の出所と身体検査をぼかさない",
      "en_display_lines": [
        "`\"Dr. Byrnes requested and received permission from the Site-17 Containment Oversight Committee to conduct a full audit of SCP-8980 and its containment area.\"`"
      ],
      "line_display_lines": [
        "`2720` / `2722`"
      ],
      "jp_display_lines": [
        "`サイト-17収容監視委員会に対してSCP-8980およびその収容区域の全面監査の実施を要請し、許可を受理されました`"
      ],
      "source_refs": [
        {
          "kind": "line",
          "line": 2720
        },
        {
          "kind": "line",
          "line": 2722
        }
      ],
      "summary": "ここは「誰が申請し、誰が通し、誰が承認したのか」を分けて読めるようにしないと、監査そのものが中立の手続きに見えてしまう。さらに、その直後の身体検査までが「通ったからやった」処理に見えやすくなる。",
      "why_bad": [
        "`requested and received` が一続きに流れて、バーンズが申請した事実が弱まる",
        "`from the Site-17 Containment Oversight Committee` の責任主体が見えにくい",
        "監査と一緒に行われた解体・捜索が、過剰な制度暴力ではなく事務処理の延長に見える"
      ],
      "fix_directions": [],
      "extra_blocks": []
    },
    {
      "id": "N-15-03",
      "severity": "note",
      "order": 1,
      "heading": "「復元不能」より冷たい調査語に寄せる余地がある",
      "en_display_lines": [
        "`\"could not be rederived\"`"
      ],
      "line_display_lines": [
        "`2958`"
      ],
      "jp_display_lines": [
        "`復元が不可能でした`"
      ],
      "source_refs": [
        {
          "kind": "line",
          "line": 2958
        }
      ],
      "summary": "このままでも結論自体は伝わるが、ここは感傷ではなく調査上の失敗を書く冷たい文である。`復元` より `再導出` の方が、手が届かなかった感じを制度語として残しやすい。",
      "why_bad": [],
      "fix_directions": [],
      "extra_blocks": []
    },
    {
      "id": "O-15-01",
      "severity": "out_of_scope",
      "order": 1,
      "heading": "`it` の訳し分け方針",
      "en_display_lines": [],
      "line_display_lines": [],
      "jp_display_lines": [],
      "source_refs": [],
      "summary": "これは記事全体の呼称設計であって、該当箇所 15 単体で決めるべき論点ではない。",
      "why_bad": [],
      "fix_directions": [],
      "extra_blocks": []
    },
    {
      "id": "E-15-01",
      "severity": "error",
      "order": 2,
      "heading": "`\"No harm, no foul\"` を字義分解しない",
      "en_display_lines": [
        "`\"No harm, no foul.\"`"
      ],
      "line_display_lines": [
        "`2802`"
      ],
      "jp_display_lines": [
        "構成語へ分解した説明調の訳"
      ],
      "source_refs": [
        {
          "kind": "line",
          "line": 2802
        }
      ],
      "summary": "ここは「問題ないから大丈夫」という、責任回避の定型句として訳すべきである。",
      "why_bad": [
        "規則違反容認の説明に見える",
        "後段の逡巡と裏切りの構図が崩れる"
      ],
      "fix_directions": [],
      "extra_blocks": []
    },
    {
      "id": "O-15-02",
      "severity": "out_of_scope",
      "order": 2,
      "heading": "該当箇所 16 のバーンズ発話をここで扱わない",
      "en_display_lines": [],
      "line_display_lines": [],
      "jp_display_lines": [],
      "source_refs": [],
      "summary": "この例は実際には該当箇所 16 側の対象であり、該当箇所 15 の修正指示からは外す。",
      "why_bad": [],
      "fix_directions": [],
      "extra_blocks": []
    },
    {
      "id": "E-15-02",
      "severity": "error",
      "order": 3,
      "heading": "発話中断と侮辱未遂を整えない",
      "en_display_lines": [
        "`the list of \"targeted engrams\" for the //nu//—ice doctor, here`"
      ],
      "line_display_lines": [
        "`2782`"
      ],
      "jp_display_lines": [
        "`この、//しんま//……いや、信頼のおける担当医`"
      ],
      "source_refs": [
        {
          "kind": "line",
          "line": 2782
        }
      ],
      "summary": "ここは言い間違えを取り繕いながら相手を下げる一瞬であり、整った自己修正にするとバーンズの軽蔑が消える。",
      "why_bad": [],
      "fix_directions": [
        "中断記号を残す",
        "言い直し後も持ち上げではなく、ごまかしとして聞こえる語にする"
      ],
      "extra_blocks": []
    },
    {
      "id": "E-15-03",
      "severity": "error",
      "order": 4,
      "heading": "`\"ma'am\"` を「奥様」にしない",
      "en_display_lines": [
        "`\"ma'am\"`"
      ],
      "line_display_lines": [
        "`2824`"
      ],
      "jp_display_lines": [
        "`奥様`"
      ],
      "source_refs": [
        {
          "kind": "line",
          "line": 2824
        }
      ],
      "summary": "ここで必要なのは職業的距離を保つ一般呼称であって、婚姻や主従を含む呼び方ではない。",
      "why_bad": [],
      "fix_directions": [],
      "extra_blocks": []
    },
    {
      "id": "E-15-04",
      "severity": "error",
      "order": 5,
      "heading": "`\"sedative\"` を「鎮痛剤」にしない",
      "en_display_lines": [
        "`\"a quick-acting light sedative agent\"`"
      ],
      "line_display_lines": [
        "`2834`"
      ],
      "jp_display_lines": [
        "`鎮痛剤`"
      ],
      "source_refs": [
        {
          "kind": "line",
          "line": 2834
        }
      ],
      "summary": "ここは痛みを取る薬ではなく、抵抗を抑えるための鎮静である。",
      "why_bad": [],
      "fix_directions": [],
      "extra_blocks": []
    },
    {
      "id": "E-15-05",
      "severity": "error",
      "order": 6,
      "heading": "`\"station\"` を部屋単位で読まない",
      "en_display_lines": [
        "`\"station\"`"
      ],
      "line_display_lines": [
        "`2796`"
      ],
      "jp_display_lines": [
        "`記憶処理室に連れ戻す`"
      ],
      "source_refs": [
        {
          "kind": "line",
          "line": 2796
        }
      ],
      "summary": "ここは室内の注射台や処置台であって、部屋全体への移動ではない。",
      "why_bad": [],
      "fix_directions": [],
      "extra_blocks": []
    },
    {
      "id": "E-15-06",
      "severity": "error",
      "order": 7,
      "heading": "`\"Oh god.\"` の原初的な絶望を平らにしない",
      "en_display_lines": [
        "`\"Oh god.\"`"
      ],
      "line_display_lines": [
        "`2766`"
      ],
      "jp_display_lines": [
        "`なんでなの。`"
      ],
      "source_refs": [
        {
          "kind": "line",
          "line": 2766
        }
      ],
      "summary": "これは問いではなく、バーンズを見た瞬間の絶望の噴出である。",
      "why_bad": [],
      "fix_directions": [],
      "extra_blocks": []
    },
    {
      "id": "E-15-07",
      "severity": "error",
      "order": 8,
      "heading": "`\"apparent\"` を曖昧化しない",
      "en_display_lines": [
        "`\"stops thrashing in apparent defeat\"`"
      ],
      "line_display_lines": [
        "`2812`"
      ],
      "jp_display_lines": [
        "`敗北したかのようにのたうち回るのを止め`"
      ],
      "source_refs": [
        {
          "kind": "line",
          "line": 2812
        }
      ],
      "summary": "ここは見るからにそう見える状態であり、「本当は違うかもしれない」含みを足さない。",
      "why_bad": [],
      "fix_directions": [],
      "extra_blocks": []
    },
    {
      "id": "E-15-08",
      "severity": "error",
      "order": 9,
      "heading": "事後総括の職権悪用を縮めない",
      "en_display_lines": [
        "`it is clear that Dr. Byrnes abused the protections assigned to the Head Researcher position to purposefully amnesticize SCP-8980 of non-essential concepts and memories. The effects of this can be seen in the following log in the SCP-8980 file.`"
      ],
      "line_display_lines": [
        "`2942`"
      ],
      "jp_display_lines": [
        "`バーンズ博士が研究主任の地位に与えられた保護権限を濫用し、SCP-8980から本質的でない概念および記憶を意図的に消去したことは明白である。その影響は、SCP-8980ファイルの以下の記録に見て取ることができる。`"
      ],
      "source_refs": [
        {
          "kind": "line",
          "line": 2942
        }
      ],
      "summary": "ここは「権限を持っていた」ではなく「権限を悪用した」ことが中心である。総括文をやわらげると、記憶消去が職権による制度暴力だったことが消える。",
      "why_bad": [
        "`abused the protections` の悪用性が弱まる",
        "`purposefully` の故意が薄れる",
        "`The effects of this can be seen...` の導入が、単なる説明文に見えてしまう"
      ],
      "fix_directions": [],
      "extra_blocks": []
    }
  ],
  "extra_sections": [],
  "conclusions": [
    "- 担当医の定型句は「宥め」ではなく「責任回避」として訳す\n- バーンズ再登場の衝撃は問いではなく絶望の噴出で受ける\n- 該当箇所外の設計論は本文の修正指示に混ぜない"
  ]
}
