{
  "segment_id": "10_form2093a_first_filing",
  "title": "SCP-8980 該当箇所 10 査読",
  "source_en_path": "articles/fragment_scp-8980-1/segments/en/10_form2093a_first_filing.wikidot",
  "source_jp_path": "`congy.wikidot` 行 2238-2459 付近",
  "source_range": {
    "start": 2238,
    "end": 2459,
    "note": "`congy.wikidot` 行 2238-2459 付近"
  },
  "usage_notes": [
    "このフォームは、SCP-8980 側の訴えとバーンズ側の自己弁明が一つの制度書式の中でぶつかる場である。\nしたがって、文章を読みやすく整えるより、バーンズの自己正当化の気味悪さを消さないことを優先する。",
    "今回は 2 件ともそのまま採る。"
  ],
  "overview": [
    "危険なのは次の 2 点である。",
    "- バーンズの自己中心的な言い直しが、良心的な補足へ整えられている\n- 接触制限と暫定収容延長を正当化する一文が丸ごと欠けている",
    "この二つが残ると、フォーム全体が「少しまずい人の釈明」ではなく、「そこそこ良心的な説明文」に見えてしまう。"
  ],
  "issues": [
    {
      "id": "E-10-01",
      "severity": "error",
      "order": 1,
      "heading": "`\"for all of us — it especially —\"` の鈍さを消してはいけない",
      "en_display_lines": [
        "`\"painful for all of us — it especially —\"`"
      ],
      "line_display_lines": [
        "`1764`"
      ],
      "jp_display_lines": [
        "`私たち全員、特にSCP-8980自身にとって辛い`"
      ],
      "source_refs": [
        {
          "kind": "line",
          "line": 1764
        }
      ],
      "summary": "ここはバーンズがまず自分たちを先に置き、あとから本人を足している。その鈍さが重要である。",
      "why_bad": [
        "現状訳だと最初から被害者を適切に勘定しているように見える",
        "原文の「思い出したように本人を足す」嫌さが消える"
      ],
      "fix_directions": [],
      "extra_blocks": []
    },
    {
      "id": "N-10-01",
      "severity": "note",
      "order": 1,
      "heading": "`\"As a former non-anomalous member of Foundation staff...\"` は申立人の資格根拠である",
      "en_display_lines": [
        "`\"As a former non-anomalous member of Foundation staff who has worked closely with containment specialists in the past, I am of the opinion I am being deprived of certain rights and subject to improper containment, including (but not limited to):\"`"
      ],
      "line_display_lines": [
        "`1698`"
      ],
      "jp_display_lines": [
        "`私は、現在担当中の収容スタッフによる私の収容対応に対して非常に不満を抱いています。過去に収容スペシャリストと密接に協力してきた財団の元非異常職員として、私は特定の権利を?奪され、不適切な収容を受けていると考えられます。`"
      ],
      "source_refs": [
        {
          "kind": "line",
          "line": 1698
        }
      ],
      "summary": "`former non-anomalous member` を単なる肩書きで終わらせず、申立ての資格を支える立場表明として読ませたい。",
      "why_bad": [],
      "fix_directions": [
        "`元非異常職員` の部分を、現在の立場との対比として立てる",
        "`過去に〜してきた` の累積を、申立ての根拠として見せる"
      ],
      "extra_blocks": []
    },
    {
      "id": "E-10-02",
      "severity": "error",
      "order": 2,
      "heading": "接触制限と暫定収容延長の一文が欠けている",
      "en_display_lines": [
        "`\"For this reason, we've had to take extra precaution regarding who SCP-8980 interacts with, both for its safety and for ours. This is also why its provisional containment has been extended.\"`"
      ],
      "line_display_lines": [
        "`1766`"
      ],
      "jp_display_lines": [
        "当該一文が欠落"
      ],
      "source_refs": [
        {
          "kind": "line",
          "line": 1766
        }
      ],
      "summary": "これは言い回しの問題ではなく、自己弁明の核心が一文ごと落ちている。",
      "why_bad": [
        "接触制限を本人のためでもあると言い張る偽善が見えない",
        "暫定収容延長の説明責任が消える",
        "バーンズの文が「危ないかもしれない」で止まり、行動の正当化まで届かない"
      ],
      "fix_directions": [],
      "extra_blocks": []
    }
  ],
  "extra_sections": [],
  "conclusions": [
    "- 申立書では、発言者の立場そのものを資格根拠として残す\n- `former` は単なる経歴ではなく、現在の主張の足場として訳す\n- 本人の不満は、制度上の権利侵害として読める形にする"
  ]
}
